{
  "$schema": "./.sitecore/schemas/RootConfigurationFile.schema.json",
  "modules": [
    "authoring/items/project/project.module.json",
    "authoring/items/content/content.module.json"
  ],
  "plugins": [
    "Sitecore.DevEx.Extensibility.Serialization@6.0.23",
    "Sitecore.DevEx.Extensibility.Publishing@6.0.23",
    "Sitecore.DevEx.Extensibility.Indexing@6.0.23",
    "Sitecore.DevEx.Extensibility.ResourcePackage@6.0.23",
    "Sitecore.DevEx.Extensibility.XMCloud@1.1.120"
  ],
  "serialization": {
    "defaultMaxRelativeItemPathLength": 100,
    "defaultModuleRelativeSerializationPath": "items",
    "removeOrphansForRoles": true,
    "removeOrphansForUsers": true,
    "continueOnItemFailure": false,
    "excludedFields": [],
    "progressiveMetadataPull": false
  },
  "settings": {
    "telemetryEnabled": false,
    "cacheAuthenticationToken": true,
    "versionComparisonEnabled": true,
    "apiClientTimeoutInMinutes": 5
  }
}